<?xml version="1.0" encoding="UTF-8"?>
<families xmlns="http://www.example.org/family_schema"
		  xmlns:xsi="http://www.w3.org/2001/XMLSchema-instance"
		  xsi:schemaLocation="http://www.example.org/family_schema family_schema.xsd">

	<family address="Sts Belarus Minsk â„–111">
		<mother>
			<name>Elena</name>
			<surname>Ivanova</surname>
			<age>30</age>
		</mother>
		
		<father>
			<name>Ivan</name>
			<surname>Ivanov</surname>
			<age>33</age>
		</father>
	  
		<children>
			<child>
				<name>Ivan</name>
				<surname>Ivanov</surname>
				<age>10</age>
			</child>
			<child>
				<name></name>
				<surname></surname>
				<age>10</age>
			</child>
			<child>
				<name></name>
				<surname></surname>
				<age>33</age>
			</child>
			<child>
				<name></name>
				<surname></surname>
				<age>33</age>
			</child>

		</children>
		
		
	</family>

</families>